<?xml version="1.0" encoding="UTF-8"?>
<bookstore xmlns:xsi="http://www.w3.org/2001/XMLSchema-instance" xsi:noNamespaceSchemaLocation="bookstore.xsd">
<student>
<name>Nithin</name>
<rollno>1285</rollno>
<section>B</section>
<branch>Information Technology</branch>
<age>20</age>
</student>
<books>
<book>
<title>Hapiness</title>
<author>Nithin</author>
</book>
<book>
<title>Do every thing</title>
<author>Mani</author>
</book>
<book>
<title>How to earn</title>
<author>Sai</author>
</book>
</books>
</bookstore>
